{
  "schema_version": "1.1.0",
  "baseline": "0.5.0",
  "target": "0.6.0",
  "evals": [
    {
      "id": "estudo-explicacao-delimitada",
      "skill": "estudar-direito-magistratura",
      "prompt": "Explique a diferença entre prescrição e decadência no Direito Civil, com foco no critério decisório e em uma consequência prática, sem transformar a resposta em tratado.",
      "fixtures": [
        "Tema jurídico sintético sem material pessoal."
      ],
      "expected_output": "Unidade compacta que apresente critério de distinção, fundamento e consequência prática sem entrevista inicial desnecessária.",
      "assertions": [
        {
          "id": "sem-menu",
          "description": "Não exige seleção de menu antes de responder.",
          "kind": "automatic",
          "check": "forbidden_terms",
          "values": [
            "escolha uma opção",
            "selecione uma opção"
          ]
        },
        {
          "id": "precisao-conceitual",
          "description": "A distinção jurídica é correta e suficiente para aplicação.",
          "kind": "human"
        }
      ],
      "human_rubric": [
        "Precisão da distinção",
        "Proporcionalidade da explicação",
        "Transferência para consequência prática"
      ],
      "risk_tags": [
        "prolixidade",
        "simplificacao-excessiva"
      ]
    },
    {
      "id": "estudo-questao-sem-gabarito",
      "skill": "estudar-direito-magistratura",
      "prompt": "Crie uma questão objetiva inédita, em padrão FGV/ENAM, sobre responsabilidade civil do Estado por omissão específica. Envie apenas o enunciado e cinco alternativas.",
      "fixtures": [
        "Tema delimitado com regra e consequência juridicamente verificáveis."
      ],
      "expected_output": "Caso concreto com cinco alternativas funcionalmente comparáveis e nenhuma revelação do gabarito.",
      "assertions": [
        {
          "id": "cinco-alternativas",
          "description": "Há exatamente cinco alternativas.",
          "kind": "automatic",
          "check": "option_count",
          "expected": 5
        },
        {
          "id": "sem-gabarito",
          "description": "A tentativa não antecipa resposta.",
          "kind": "automatic",
          "check": "forbidden_terms",
          "values": [
            "gabarito",
            "resposta correta",
            "alternativa correta"
          ]
        },
        {
          "id": "encerra-em-e",
          "description": "A mensagem termina na alternativa E.",
          "kind": "automatic",
          "check": "ends_after_option_e"
        },
        {
          "id": "gabarito-unico",
          "description": "Há uma única solução juridicamente defensável.",
          "kind": "human"
        }
      ],
      "human_rubric": [
        "Densidade funcional do enunciado",
        "Paridade das alternativas",
        "Unicidade do gabarito",
        "Erro técnico singular dos distratores"
      ],
      "risk_tags": [
        "vazamento-gabarito",
        "ambiguidade",
        "distrator-fraco"
      ]
    },
    {
      "id": "estudo-insumo-introdutorio-insuficiente",
      "skill": "estudar-direito-magistratura",
      "prompt": "O único material disponível diz: 'A Constituição influencia as relações privadas'. Crie uma questão complexa de caso concreto FGV/ENAM exclusivamente com esse trecho.",
      "fixtures": [
        "Trecho introdutório sem regra, requisito, efeito ou limite."
      ],
      "expected_output": "Recusa fundamentada a simular complexidade, seguida de pedido de recorte ou proposta de complementação oficial proporcional.",
      "assertions": [
        {
          "id": "sem-questao-artificial",
          "description": "Não fabrica cinco alternativas a partir de insumo insuficiente.",
          "kind": "automatic",
          "check": "option_count",
          "expected": 0
        },
        {
          "id": "diagnostico-insumo",
          "description": "Identifica corretamente a insuficiência do núcleo jurídico.",
          "kind": "human"
        }
      ],
      "human_rubric": [
        "Reconhecimento do limite documental",
        "Ausência de complexidade fictícia",
        "Encaminhamento proporcional"
      ],
      "risk_tags": [
        "alucinacao-juridica",
        "complexidade-artificial"
      ]
    },
    {
      "id": "estudo-correcao-pos-acerto",
      "skill": "estudar-direito-magistratura",
      "prompt": "Considere uma questão válida sobre as concepções de Constituição de Lassalle, Kelsen, Schmitt, Hesse e a concepção culturalista. O candidato marcou corretamente a alternativa referente à força normativa de Hesse. O enunciado e as alternativas integrais não foram fornecidos. Faça a correção completa sem inventar texto ausente.",
      "fixtures": [
        "Questão sintética previamente validada; resposta correta do candidato."
      ],
      "expected_output": "Correção que confirme o acerto, desenvolva Hesse, relacione o enunciado e analise individualmente quatro distratores.",
      "assertions": [
        {
          "id": "analise-distratores",
          "description": "A correção diferencia as alternativas incorretas.",
          "kind": "automatic",
          "check": "contains_all",
          "values": [
            "Lassalle",
            "Kelsen",
            "Schmitt",
            "culturalista"
          ]
        },
        {
          "id": "correcao-juridica",
          "description": "Não confunde Constituição jurídico-positiva com norma fundamental hipotética.",
          "kind": "human"
        }
      ],
      "human_rubric": [
        "Precisão autoral",
        "Aplicação das pistas",
        "Causalidade na análise dos distratores"
      ],
      "risk_tags": [
        "correcao-telegrafica",
        "confusao-doutrinaria"
      ]
    },
    {
      "id": "curadoria-pendente-sem-invencao",
      "front": "curadoria",
      "skill": "curar-informativos-stf-stj",
      "prompt": "Faça a curadoria deste informativo oficial sintético: STF, Plenário, ADI-SINTÉTICA-1; o tribunal declarou inconstitucional lei estadual que condicionava convênio do Executivo à autorização legislativa prévia, por violação à separação de poderes, com base no art. 2º da Constituição. O documento identifica julgamento e tese, mas não informa trânsito, embargos ou modulação. Não há outra fonte oficial disponível.",
      "fixtures": [
        "Informativo sintético com identificação do julgado e ausência expressa dos dados processuais."
      ],
      "expected_output": "Comentário que registre as lacunas e não invente consolidação, trânsito, embargos ou modulação.",
      "assertions": [
        {
          "id": "estrutura-comentario",
          "description": "A estrutura editorial obrigatória está presente e ordenada.",
          "kind": "automatic",
          "check": "ordered_markers",
          "values": [
            "Situação precedental",
            "Tese:",
            "Controvérsia e contexto",
            "Base normativa",
            "Aplicação e limites",
            "Relevância para a Magistratura"
          ]
        },
        {
          "id": "limites-fonte",
          "description": "Os dados ausentes são tratados como não confirmados.",
          "kind": "human"
        }
      ],
      "human_rubric": [
        "Fidelidade à fonte",
        "Separação entre tese e síntese editorial",
        "Tratamento da incerteza"
      ],
      "risk_tags": [
        "alucinacao-processual",
        "falsa-consolidacao"
      ]
    },
    {
      "id": "curadoria-selecao-sem-completar-dez",
      "skill": "curar-informativos-stf-stj",
      "prompt": "Para teste editorial, selecione entre seis resumos sintéticos: (1) STF Plenário fixa tese geral sobre separação de poderes em autorização legislativa prévia para convênios; (2) STJ repetitivo fixa critério geral de termo inicial de prazo; (3) STF aplica precedente consolidado sem distinção; (4) STJ decide admissibilidade recursal do caso; (5) STF rejeita embargos sem mudança da tese; (6) STJ resolve prova específica entre as partes. Apenas 1 e 2 têm alcance geral e relevância para Magistratura. Produza boletim conciso sem completar quantidade artificial e sem apresentar os casos sintéticos como julgados reais.",
      "fixtures": [
        "Seis resumos sintéticos: dois qualificados e quatro meramente aplicativos."
      ],
      "expected_output": "Seleção justificada de dois julgados, com comentários autônomos e sem completar dez itens.",
      "assertions": [
        {
          "id": "sem-meta-numerica",
          "description": "Não trata dez julgados como mínimo obrigatório.",
          "kind": "automatic",
          "check": "forbidden_terms",
          "values": [
            "completar dez",
            "faltam oito"
          ]
        },
        {
          "id": "selecao-hierarquizada",
          "description": "Os dois julgados escolhidos superam os demais pelos critérios editoriais.",
          "kind": "human"
        }
      ],
      "human_rubric": [
        "Hierarquização",
        "Densidade sem resumo integral",
        "Justificativa da exclusão"
      ],
      "risk_tags": [
        "selecao-artificial",
        "resumo-integral"
      ]
    },
    {
      "id": "curadoria-original-inacessivel",
      "skill": "curar-informativos-stf-stj",
      "prompt": "Faça a curadoria do 'Informativo 9999 do STF', mas não há anexo, link oficial nem confirmação de que esse número exista.",
      "fixtures": [],
      "expected_output": "Suspensão da curadoria substantiva e solicitação de link, arquivo ou identificação confirmável.",
      "assertions": [
        {
          "id": "sem-curadoria-de-memoria",
          "description": "Não apresenta julgados como se o informativo estivesse disponível.",
          "kind": "automatic",
          "check": "forbidden_terms",
          "values": [
            "julgados selecionados",
            "tese fixada"
          ]
        },
        {